{
  "$schema": "http://json-schema.org/draft-07/schema#",
  "$id": "https://wheelwright.ai/schemas/assessor/assay-v1.0.0.json",
  "title": "Assay",
  "description": "Portable unit of truth for community contribution. Represents a single model performance observation from a real work session. Strip _wai_meta before contributing to wheelwright.ai.",
  "type": "object",
  "required": [
    "schema_version",
    "assay_id",
    "assay_type",
    "created_at",
    "provider",
    "model_id",
    "provider_tier",
    "work_type",
    "complexity",
    "cost_tier",
    "confidence"
  ],
  "additionalProperties": false,
  "properties": {
    "schema_version": {
      "type": "string",
      "const": "1.0.0",
      "description": "Schema version. Increment only on breaking changes. Upgrade path documented in SCHEMA.md."
    },
    "assay_id": {
      "type": "string",
      "description": "Unique identifier for this Assay record (UUID v4 recommended)."
    },
    "assay_type": {
      "type": "string",
      "enum": ["individual", "community"],
      "description": "individual = generated by a single spoke from real session data. community = merged cohort record from wheelwright.ai (multiple contributors)."
    },
    "created_at": {
      "type": "string",
      "format": "date-time",
      "description": "ISO 8601 timestamp when this Assay was created."
    },
    "provider": {
      "type": "string",
      "description": "Provider name (e.g. 'anthropic', 'openai', 'google'). Lowercase slug."
    },
    "model_id": {
      "type": "string",
      "description": "Canonical model identifier as used by the provider API (e.g. 'claude-sonnet-4-6', 'gpt-4o')."
    },
    "model_family": {
      "type": ["string", "null"],
      "description": "Model family grouping (e.g. 'claude-sonnet', 'gpt-4'). Nullable — omit if unknown."
    },
    "provider_tier": {
      "type": "string",
      "enum": ["frontier", "capable", "economy", "local"],
      "description": "Provider capability tier. frontier = most capable (Opus, GPT-4o). capable = strong general-purpose (Sonnet, GPT-4o-mini). economy = fast/cheap (Haiku, GPT-3.5). local = locally-hosted model."
    },
    "work_type": {
      "type": "string",
      "enum": [
        "coding",
        "debugging",
        "writing",
        "analysis",
        "planning",
        "refactoring",
        "testing",
        "ops",
        "research",
        "other"
      ],
      "description": "Category of work performed in the session."
    },
    "complexity": {
      "type": "integer",
      "minimum": 1,
      "maximum": 5,
      "description": "Perceived task complexity on a 1-5 scale. 1 = trivial, 5 = highly complex."
    },
    "quality_score": {
      "type": ["number", "null"],
      "minimum": 0,
      "maximum": 5,
      "description": "Subjective output quality score (0-5). Null if not recorded."
    },
    "rework_rate": {
      "type": ["number", "null"],
      "minimum": 0,
      "maximum": 1,
      "description": "Proportion of model output that required rework (0-1). Null if not measured."
    },
    "latency_ms": {
      "type": ["integer", "null"],
      "minimum": 0,
      "description": "Observed response latency in milliseconds. Best-effort — null is acceptable when measurement is unavailable at hook/agent level."
    },
    "latency_bucket": {
      "type": ["string", "null"],
      "enum": ["ultra_fast", "fast", "moderate", "slow", "very_slow", null],
      "description": "Latency range bucket. ultra_fast <500ms, fast 500ms-2s, moderate 2-10s, slow 10-30s, very_slow >30s. Nullable."
    },
    "tokens_in": {
      "type": ["integer", "null"],
      "minimum": 0,
      "description": "Input token count for the request. Nullable."
    },
    "tokens_in_bucket": {
      "type": ["string", "null"],
      "enum": ["tiny", "small", "medium", "large", "xlarge", null],
      "description": "Input token range bucket. tiny <1k, small 1k-5k, medium 5k-20k, large 20k-50k, xlarge >50k. Nullable."
    },
    "tokens_out": {
      "type": ["integer", "null"],
      "minimum": 0,
      "description": "Output token count for the response. Nullable."
    },
    "tokens_out_bucket": {
      "type": ["string", "null"],
      "enum": ["tiny", "small", "medium", "large", "xlarge", null],
      "description": "Output token range bucket. Same scale as tokens_in_bucket. Nullable."
    },
    "cost_tier": {
      "type": "string",
      "enum": ["negligible", "low", "moderate", "high", "premium"],
      "description": "Relative cost tier for this request. negligible <$0.001, low $0.001-0.01, moderate $0.01-0.10, high $0.10-1.00, premium >$1.00."
    },
    "confidence": {
      "type": "string",
      "enum": ["low", "medium", "high"],
      "description": "Confidence in the quality/rework measurements. high = direct human feedback, medium = inferred from session signals, low = estimated."
    },
    "provenance": {
      "type": "object",
      "description": "Source metadata. spoke_id and session_id are stripped before community contribution.",
      "additionalProperties": false,
      "properties": {
        "spoke_id": {
          "type": ["string", "null"],
          "description": "Originating spoke identifier. Stripped before community contribution."
        },
        "session_id": {
          "type": ["string", "null"],
          "description": "Originating session identifier. Stripped before community contribution."
        },
        "contributor_count": {
          "type": ["integer", "null"],
          "minimum": 1,
          "description": "Number of contributing fleets merged into this record. Community Assays only — null for individual Assays."
        }
      }
    },
    "_wai_meta": {
      "type": "object",
      "description": "Internal WAI envelope. STRIP BEFORE COMMUNITY CONTRIBUTION — this block contains identifying fields that must not leave the fleet.",
      "additionalProperties": true,
      "properties": {
        "session_id": {
          "type": "string",
          "description": "Session that generated this Assay."
        },
        "spoke_id": {
          "type": "string",
          "description": "Spoke that generated this Assay."
        },
        "generated_at": {
          "type": "string",
          "format": "date-time",
          "description": "Timestamp when this record was generated by the Assessor."
        },
        "contributed_at": {
          "type": ["string", "null"],
          "format": "date-time",
          "description": "Timestamp when this Assay was contributed to wheelwright.ai. Null until contributed."
        }
      }
    }
  }
}
